{
  "patient_id": "PAT_001",
  "name": "Robert Johnson",
  "age": 55,
  "sex": "Male",
  "weight_kg": 80.5,
  "height_cm": 180,
  "current_medications": [
    {
      "drug_name": "Lisinopril",
      "dose": "10 mg",
      "frequency": "once daily",
      "route": "oral"
    },
    {
      "drug_name": "Simvastatin",
      "dose": "20 mg",
      "frequency": "bedtime"
    }
  ],
  "clinical_conditions": [
    "Hypertension",
    "Hyperlipidemia"
  ],
  "allergies": [
    "Shellfish"
  ],
  "lab_results": {
    "Creatinine": "1.1 mg/dL",
    "eGFR": "75 mL/min/1.73m2",
    "Total_Cholesterol": "180 mg/dL"
  }
}